Annotator,Document ID,Shared? ,SentNum,Sent
1,wsj_0001.mrg,Y,1,"Mr. Vinken is chairman of Elsevier N.V. , the Dutch publishing group ."
1,wsj_0097.mrg,Y,4,U.S. stock-index futures are n't even traded *-1 in Japan now .
1,wsj_0097.mrg,Y,5,"And because of the time difference , the Japanese *RNR*-1 and the U.S. *RNR*-1 markets ' trading hours do n't overlap ."
1,wsj_0097.mrg,Y,7,"About 11.6 % of all program trading by New York Stock Exchange firms in September took place in foreign markets , according to Big Board data ."
1,wsj_0097.mrg,Y,10,Program trading has taken off in Japan since last year 's introduction of home-market stock-index futures trading on the Tokyo and Osaka stock exchanges .
1,wsj_0097.mrg,Y,14,"`` Maybe it was n't enough , '' a Finance Ministry official noted *T*-1 after the Dec. 7 surge ."
1,wsj_0097.mrg,Y,15,Japan 's regulators have since tightened controls on index-related stock purchases .
1,wsj_0097.mrg,Y,17,"Some U.S. firms , notably Salomon Inc. and Morgan Stanley Group Inc. , have reaped a hefty chunk of their Japanese earnings from index arbitrage , both for customers and for their own accounts ."
1,wsj_0097.mrg,Y,21,"`` It has not been disruptive in the markets here , '' Mr. Maughan said *T*-1 ."
1,wsj_0097.mrg,Y,23,The British also are scrutinizing program trades .
1,wsj_0097.mrg,Y,25,`` We do n't think 0 there is cause for concern at the moment . ''
1,wsj_0097.mrg,Y,26,London serves increasingly as a conduit for program trading of U.S. stocks .
1,wsj_0097.mrg,Y,32,Britain has two main index-arbitrage instruments .
1,wsj_0097.mrg,Y,33,A Financial Times-Stock Exchange 100-share index option contract is traded *-162 on the London Stock Exchange 's Traded Options Market .
1,wsj_0097.mrg,Y,34,And an FT-SE futures contract is traded *-1 on the London International Financial Futures Exchange .
1,wsj_0097.mrg,Y,35,Both contracts have gained a following since the 1987 global market crash .
1,wsj_0104.mrg,Y,0,"Due to an editing error , a letter to the editor in yesterday 's edition from Frederick H. Hallett mistakenly identified the NRDC ."
1,wsj_0087.mrg,Y,0,"Five things 0 you can do *T*-1 for $ 15,000 *U* or less :"
1,wsj_0087.mrg,Y,1,1 . * Buy a new Chevrolet .
1,wsj_0087.mrg,Y,2,2 . * Take a Hawaiian vacation .
1,wsj_0087.mrg,Y,3,3 . * Send your child to a university .
1,wsj_0087.mrg,Y,4,4 . * Buy a diamond necklace .
1,wsj_0087.mrg,Y,5,5 . * Make a lasting difference in the regulatory life of an American savings-and-loan association through the Foster Corporate Parents Plan .
1,wsj_0087.mrg,Y,9,"As a Foster Corporate Parent , you 'll be helping a neighborhood S&L in areas crucial to its survival ."
1,wsj_0087.mrg,Y,12,Performing loans .
1,wsj_0139.mrg,Y,1,"With lipsticks , liners , lotions and creams , There are still beauty plans left 0 * to tackle *T*-1 : But as the years go by , it seems That before I paint , I should spackle ."
1,wsj_0141.mrg,Y,0,"Consumer confidence stayed strong in October , despite the unsettling gyrations of the stock market ."
1,wsj_0141.mrg,Y,4,The index was 116.9 in October 1988 and in the past year has ranged from a low of 112.9 to a high of 120.7 .
1,wsj_0141.mrg,Y,5,It uses a base of 100 in 1985 .
1,wsj_0141.mrg,Y,6,"In October , more people *ICH*-1 said that present business conditions were `` good '' than in September ."
1,wsj_0141.mrg,Y,7,An equal number in each month said that employment conditions were good .
1,wsj_0141.mrg,Y,20,Home purchase plans increased to 3.3 % from 3.1 % in the two recent months .
1,wsj_0141.mrg,Y,22,"In 1989 , home purchase plans have ranged monthly from 2.9 % *RNR*-1 to 3.7 % *RNR*-1 of respondents ."
1,wsj_0090.mrg,Y,1,That has been particularly true this year with many companies raising their payouts more than 10 % .
1,wsj_0090.mrg,Y,4,"That can be a trap for unwary investors , says 0 *T*-1 Richard Bernstein , senior quantitative analyst at Merrill Lynch & Co ."
1,wsj_0090.mrg,Y,13,"Payouts on the S&P 500 stocks rose 10 % in 1988 , according to Standard & Poor 's Corp. , and Wall Street estimates for 1989 growth are generally between 9 % and 14 % *U* ."
1,wsj_0090.mrg,Y,16,"As a result , the market 's dividend yield -- dividends as a percentage of price -- has slid to a level that *T*-232 is fairly low and unenticing by historical standards ."
1,wsj_0090.mrg,Y,18,They are keeping a close watch on the yield on the S&P 500 .
1,wsj_0090.mrg,Y,22,"In fact , `` the market has always tanked ."
1,wsj_0090.mrg,Y,25,The last time 0 the S&P 500 yield dropped below 3 % *T*-1 was in the summer of 1987 .
1,wsj_0090.mrg,Y,29,"Still , some market analysts say 0 the current 3.3 % reading is n't as troublesome as it might have been *?* in years past ."
1,wsj_0090.mrg,Y,32,"So , while stock prices may look fairly high relative to dividends , they are not excessive relative to the underlying corporate strength ."
1,wsj_0090.mrg,Y,35,"That is just a tad below the average of the past 40 years or so , he says 0 *T*-1 ."
1,wsj_0090.mrg,Y,36,What *T*-234 will happen to dividend growth next year ?
1,wsj_0090.mrg,Y,41,Dividend growth on the order of 12 % is expected *-142 by both Mr. Coxon of Cigna and Mr. Einhorn of Goldman Sachs .
1,wsj_0090.mrg,Y,46,"While the S&P tally does n't measure the magnitude of dividend changes , a further slippage in the number of dividend increases could be a harbinger of slower dividend growth next year ."
1,wsj_0153.mrg,Y,1,"The aerospace , automotive supply , electronics and printing-press concern also indicated that the first half of fiscal 1990 could be rough ."
1,wsj_0153.mrg,Y,4,"For fiscal 1989 's fourth quarter , Rockwell 's net income totaled $ 126.1 million *U* , or 50 cents a share ."
1,wsj_0153.mrg,Y,5,"That compares with operating earnings of $ 132.9 million *U* , or 49 cents a share , the year earlier ."
1,wsj_0153.mrg,Y,7,Sales rose 4 % to $ 3.28 billion *U* from $ 3.16 billion *U* .
1,wsj_0153.mrg,Y,9,"Overall , pretax electronics earnings soared 12 % to $ 107.9 million *U* from $ 96.4 million *U* ."
1,wsj_0153.mrg,Y,16,"The company also took hits in the fourth quarters of 1989 and 1988 on a fixed-price weapons-modernization development program -- probably the C-130 gunship , according to analysts ."
1,wsj_0153.mrg,Y,17,"For fiscal 1989 , the company posted net of $ 734.9 million *U* , or $ 2.87 *U* a share , down from $ 811.9 million *U* , or $ 3.04 *U* a share , in fiscal 1988 ."
1,wsj_0153.mrg,Y,18,"* Excluding one-time additions to profit in each year , earnings per share were $ 2.47 *U* , up 7.4 % from $ 2.30 *U* in fiscal 1988 ."
1,wsj_0153.mrg,Y,19,Sales for the year rose 5 % to $ 12.52 billion *U* from $ 11.95 billion *U* in fiscal 1988 .
1,wsj_0059.mrg,Y,7,"Sterling was quoted *-1 at $ 1.5755 *U* , down from $ 1.5805 *U* late Tuesday ."
1,wsj_0059.mrg,Y,8,"In Tokyo Thursday , the U.S. currency opened for trading at 143.93 yen , up from Wednesday 's Tokyo close of 143.08 yen ."
1,wsj_0059.mrg,Y,11,"He cites the recent deal between the Mitsubishi Estate Co. and the Rockefeller Group , as well as the possible white knight role of an undisclosed Japanese company in the Georgia-Pacific Corp. takeover bid for Great Northern Nekoosa Corp. as evidence ."
1,wsj_0059.mrg,Y,21,"On the Commodity Exchange in New York , gold for current delivery settled at $ 374.20 *U* an ounce , down 50 cents ."
1,wsj_0059.mrg,Y,22,Estimated volume was a moderate 3.5 million ounces .
1,wsj_0059.mrg,Y,23,"In early trading in Hong Kong Thursday , gold was quoted *-1 at $ 374.19 *U* an ounce ."
1,wsj_0154.mrg,Y,2,"That package now sells for about $ 2,099 *U* ."
1,wsj_0131.mrg,Y,0,"Odyssey Partners Limited Partnership , an investment firm , completed the purchase of May Department Stores Co. 's Caldor discount chain for $ 500 million *U* plus the assumption of $ 52 million *U* in debt ."
1,wsj_0131.mrg,Y,2,"May Stores , St. Louis , runs such well-known department stores as Lord & Taylor ."
1,wsj_0109.mrg,Y,3,Wall Street reacted favorably to Mr. McGovern 's departure and its implications .
1,wsj_0109.mrg,Y,9,"Campbell 's international businesses , particularly in the U.K. and Italy , appear *-1 to be at the heart of its problems ."
1,wsj_0109.mrg,Y,10,Growth has fallen short of targets and operating earnings are far below results in U.S. units .
1,wsj_0109.mrg,Y,12,"Similarly , Campbell 's Italian biscuit operation , D. Lazzaroni & Co. , has been hurt *-40 by overproduction and distribution problems ."
1,wsj_0109.mrg,Y,14,"However , neither Mr. Baum nor Mr. Harper has much international experience ."
1,wsj_0109.mrg,Y,18,"Mr. McGovern , 63 , had been under intense pressure *ICH*-1 from the board * to boost Campbell 's mediocre performance to the level of other food companies ."
1,wsj_0109.mrg,Y,29,"For fiscal 1989 , Mr. McGovern received a salary of $ 877,663 *U* ."
1,wsj_0093.mrg,Y,0,It was Richard Nixon 's first visit to China in 1972 that *T*-238 set in motion the historic rapprochement between Beijing and Washington .
1,wsj_0093.mrg,Y,3,"The Chinese , in turn , took aim at American `` interference '' in China 's domestic affairs ."
1,wsj_0093.mrg,Y,6,"The tension was evident on Wednesday evening during Mr. Nixon 's final banquet toast , normally an opportunity for * reciting platitudes about eternal friendship ."
1,wsj_0093.mrg,Y,10,The Chinese responded in an equally undiplomatic fashion .
1,wsj_0093.mrg,Y,13,China was the real victim and it *EXP*-1 is unjust * to reprove China for it . ''
1,wsj_0093.mrg,Y,16,"Relations between China and the U.S. have been tense since June 7 , when Chinese dissident Fang Lizhi and his wife , Li Shuxian , took refuge in the U.S. Embassy in Beijing *T*-1 ."
1,wsj_0093.mrg,Y,21,Mr. Nixon was *-1 to leave China today .
2,wsj_0083.mrg,N,20,Even a low-tech product like plate glass can catch a trading company 's fancy if there 's a strategic fit .
2,wsj_0083.mrg,N,21,"Free State Glass Industries of Warrenton , Va. , a small fabricator of architectural glass , was foundering under its original management ."
2,wsj_0083.mrg,N,24,"`` It 's not just a simple investment in a small company , '' Mr. Wakui says *T*-1 ."
2,wsj_0083.mrg,N,26,"Mitsubishi 's investment in Free State is `` very small ... less than $ 4 million *U* , '' Mr. Wakui says 0 *T*-1 ."
2,wsj_0083.mrg,N,30,They operate ships and banks .
2,wsj_0083.mrg,N,33,A host of electronics firms in California 's Silicon Valley were financed *-119 with trading-company venture capital .
2,wsj_0083.mrg,N,43,Sales by these subsidiaries in the fiscal year ending last March were more than $ 17 billion *U* .
2,wsj_0083.mrg,N,44,"A 1 % to 2 % *U* return on $ 17 billion *U* `` ai n't hay , '' Mr. Klauser says 0 *T*-1 ."
2,wsj_0069.mrg,N,1,Mr. Butler will remain on the board as a nonexecutive director .
2,wsj_0080.mrg,N,3,"However , it has n't yet made any proposals to shareholders ."
2,wsj_0080.mrg,N,6,It did n't elaborate .
2,wsj_0080.mrg,N,9,`` He appears *-1 to be in it for the long haul . ''
2,wsj_0080.mrg,N,10,Mr. Simmons and NL already own a 9.9 % stake in Georgia Gulf .
2,wsj_0080.mrg,N,12,NL is officially making the offer .
2,wsj_0080.mrg,N,22,"In other transactions , Mr. Simmons has followed friendly offers with a hostile tender offer ."
2,wsj_0080.mrg,N,25,"In the third quarter , Georgia Gulf earned $ 46.1 million *U* , or $ 1.85 *U* a share , down from $ 53 million *U* , or $ 1.85 *U* a share on fewer shares outstanding ."
2,wsj_0080.mrg,N,26,Sales fell to $ 251.2 million *U* from $ 278.7 million *U* .
2,wsj_0110.mrg,N,1,The key U.S. and foreign annual interest rates below are a guide to general levels but do n't always represent actual transactions .
2,wsj_0110.mrg,N,4,"FEDERAL FUNDS : 9 1\/2 % high , 8 3\/4 % low , 8 3\/4 % near closing bid , 9 % offered * ."
2,wsj_0110.mrg,N,5,Reserves traded * among commercial banks for overnight use in amounts of $ 1 million or more *U* .
2,wsj_0110.mrg,N,11,COMMERCIAL PAPER placed * directly by General Motors Acceptance Corp. : 8.55 % 30 to 44 days ; 8.25 % 45 to 59 days ; 8.45 % 60 to 89 days ; 8 % 90 to 119 days ; 7.90 % 120 to 149 days ; 7.80 % 150 to 179 days ; 7.55 % 180 to 270 days .
2,wsj_0110.mrg,N,12,"COMMERCIAL PAPER : High-grade unsecured notes sold * through dealers by major corporations in multiples of $ 1,000 *U* : 8.65 % 30 days ; 8.575 % 60 days ; 8.50 % 90 days ."
2,wsj_0110.mrg,N,14,"Average of top rates paid * by major New York banks on primary new issues of negotiable C.D.s , usually on amounts of $ 1 million and more *U* ."
2,wsj_0110.mrg,N,18,"Negotiable , bank-backed business credit instruments typically financing an import order ."
2,wsj_0110.mrg,N,20,LONDON INTERBANK OFFERED RATES -LRB- LIBOR -RRB- : 8 3\/4 % one month ; 8 3\/4 % three months ; 8 1\/2 % six months ; 8 7\/16 % one year .
2,wsj_0110.mrg,N,23,These rate indications are n't directly comparable ; lending practices vary widely by location .
2,wsj_0110.mrg,N,24,"TREASURY BILLS : Results of the Monday , October 30 , 1989 , auction of short-term U.S. government bills , sold * at a discount from face value in units of $ 10,000 to $ 1 million *U* : 7.78 % 13 weeks ; 7.62 % 26 weeks ."
2,wsj_0110.mrg,N,25,FEDERAL HOME LOAN MORTGAGE CORP . -LRB- Freddie Mac -RRB- : Posted yields on 30-year mortgage commitments for delivery within 30 days .
2,wsj_0019.mrg,N,0,"John R. Stevens , 49 years old , was named *-27 senior executive vice president and chief operating officer , both new positions ."
2,wsj_0019.mrg,N,3,"Arthur A. Hatch , 59 , was named *-28 executive vice president of the company ."
2,wsj_0019.mrg,N,7,"Robert P. Tassinari , 63 , was named *-29 senior vice president of Eastern Utilities ."
2,wsj_0071.mrg,N,4,Diamond Creek 1985 Lake Vineyard Cabernet weighed in this fall with a sticker price of $ 100 *U* a bottle .
2,wsj_0071.mrg,N,7,These first magnitude wines ranged in price from $ 40 *U* *RNR*-1 to $ 125 *U* *RNR*-1 a bottle .
2,wsj_0071.mrg,N,8,"In the last year or so , however , this exclusive club has taken in a host of flashy new members ."
2,wsj_0071.mrg,N,10,France can boast the lion 's share of high-priced bottles .
2,wsj_0071.mrg,N,11,"Bordeaux 's first growths from 1985 and 1986 are $ 60 to $ 80 *U* each -LRB- except for the smallest in terms of production , Chateau Petrus , which *T*-162 costs around $ 250 *U* ! -RRB- ."
2,wsj_0071.mrg,N,12,"These prices seem rather modest , however , in light of other French wines from current vintages ."
2,wsj_0071.mrg,N,14,"In Champagne , some of the prestige cuvees are inching toward $ 100 *U* a bottle ."
2,wsj_0071.mrg,N,15,The first Champagne 0 *T*-1 to crack that price barrier was the 1979 Salon de Mesnil Blanc de Blancs .
2,wsj_0071.mrg,N,18,The great reds of the Rhone Valley have soared in price as well .
2,wsj_0071.mrg,N,20,"None of France 's wine regions can steal a march on Burgundy , however ."
2,wsj_0071.mrg,N,21,"The six wines of the Domaine de la Romanee-Conti , 72 of the most precious acres of vineyard anywhere in the world , have commanded three-digit price tags for several years now ."
2,wsj_0071.mrg,N,22,"With the 1985 vintage , they soared higher : La Tache , $ 195 *U* ; Richebourg , $ 180 *U* ; Romanee-Conti , $ 225 *U* ."
2,wsj_0071.mrg,N,23,"Another small Burgundy estate , Coche-Dury , has just offered its 1987 Corton-Charlemagne for $ 155 *U* ."
2,wsj_0071.mrg,N,25,"Spain 's Vega Secilia Unico 1979 -LRB- released * only in its 10th year -RRB- is $ 70 *U* , as is *?* Australia 's Grange Hermitage 1982 ."
2,wsj_0071.mrg,N,30,"Some of the newer wines , even at $ 90 to $ 100 *U* *ICH*-1 a bottle or so , almost offer a bargain . ''"
2,wsj_0071.mrg,N,31,* Take Lake Vineyard Cabernet from Diamond Creek .
2,wsj_0071.mrg,N,41,"`` It 's just sort of a one-upsmanship thing with some people , '' added *T*-1 Larry Shapiro ."
2,wsj_0071.mrg,N,45,But consumers who *T*-169 buy at this level are also more knowledgeable than they were *?* a few years ago .
2,wsj_0071.mrg,N,53,"In every major market in the U.S. , for instance , you can buy '86 La Tache or Richebourg , virtually all of the first growth Bordeaux -LRB- except Petrus -RRB- , as well as Opus One and Dominus from California and , at the moment , the Stag 's Leap 1985 Cask 23 ."
2,wsj_0130.mrg,N,3,"Too often now , a single court decision becomes the precedent for other , less compelling cases ."
2,wsj_0130.mrg,N,6,"In the 1970s , scientists reported cancer cases among the daughters of DES users ."
2,wsj_0130.mrg,N,10,This has some logic .
2,wsj_0130.mrg,N,12,But courts quickly tumbled down a slippery slope .
2,wsj_0130.mrg,N,16,"Despite the Supreme Court 's refusal * to hear the case , there are serious constitutional issues of due process and uncompensated takings from the defendants ."
2,wsj_0130.mrg,N,27,DES daughters and other victims of drugs would be better off if their cases were taken *-1 out of the courts .
2,wsj_0099.mrg,N,0,"Zenith Data Systems Corp. , a subsidiary of Zenith Electronics Corp. , received a $ 534 million *U* Navy contract for software and services of microcomputers over an 84-month period ."
2,wsj_0099.mrg,N,1,Rockwell International Corp. won a $ 130.7 million *U* Air Force contract for AC-130U gunship replacement aircraft .
2,wsj_0099.mrg,N,3,Federal Data Corp. got a $ 29.4 million *U* Air Force contract for intelligence data handling .
2,wsj_0174.mrg,N,9,The ban on cross-border movement was imposed *-1 last month after a massive exodus of emigres to West Germany .
2,wsj_0174.mrg,N,10,"Also , a Communist official for the first time said 0 the future of the Berlin Wall could be open to discussion ."
2,wsj_0174.mrg,N,16,House-Senate conferees approved major portions of a package for more than $ 500 million *U* in economic aid for Poland .
2,wsj_0174.mrg,N,19,South African troops were placed *-1 on alert .
2,wsj_0174.mrg,N,24,Beijing 's rulers complained to the former president about U.S. `` interference '' in China 's domestic affairs .
2,wsj_0052.mrg,N,2,Terms were n't disclosed *-1 .
2,wsj_0052.mrg,N,6,NTG was formed *-1 by Osborn Communications Corp. and Desai Capital .
2,wsj_0009.mrg,N,0,Clark J. Vitulli was named *-12 senior vice president *RNR*-1 and general manager *RNR*-1 of this U.S. sales and marketing arm of Japanese auto maker Mazda Motor Corp .
2,wsj_0009.mrg,N,1,"In the new position he will oversee Mazda 's U.S. sales , service , parts and marketing operations ."
2,wsj_0011.mrg,N,5,"Despite the gloomy forecast , South Korea has recorded a trade surplus of $ 71 million *U* so far this year ."
2,wsj_0098.mrg,N,1,The vote came after a debate replete with complaints from both proponents and critics of a substantial increase in the wage floor .
2,wsj_0098.mrg,N,7,"`` There are no smiles about this bill , '' Rep. Pat Williams -LRB- D. , Mont . -RRB- said *T*-1 during House floor debate yesterday ."
2,wsj_0098.mrg,N,16,The training wage covers only workers who *T*-260 are 16 to 19 years old .
2,wsj_0049.mrg,N,7,"Until last week , the IRS rarely acted on the incomplete forms ."
2,wsj_0049.mrg,N,11,These individuals may not necessarily be under investigation when they hire lawyers *T*-1 .
2,wsj_0049.mrg,N,29,THE WAR OVER FEDERAL JUDICIAL SALARIES takes a victim .
2,wsj_0049.mrg,N,30,"Often , judges ease into more lucrative private practice with little fanfare , but not federal Judge Raul A. Ramirez in Sacramento , Calif ."
2,wsj_0049.mrg,N,32,The reason : the refusal *ICH*-1 of Congress * to give federal judges a raise .
2,wsj_0049.mrg,N,39,"At his new job , as partner in charge of federal litigation in the Sacramento office of Orrick , Herrington & Sutcliffe , he will make out much better ."
2,wsj_0049.mrg,N,43,"The dispute involves Darkhorse Productions Inc. , a TV production company in which Mr. Trudeau is a co-owner *T*-1 ."
2,wsj_0049.mrg,N,45,The guild began a strike against the TV and movie industry in March 1988 .
2,wsj_0049.mrg,N,53,ABORTION RULING UPHELD *-1 :
2,wsj_0049.mrg,N,59,INQUIRY CLEARS TEXAS JUDGE of bias in comments on homosexual murder victims .
2,wsj_0049.mrg,N,66,GAF TRIAL goes to round three .
2,wsj_0049.mrg,N,69,The first two GAF trials ended in mistrials earlier this year .
2,wsj_0049.mrg,N,71,* SWITCHING TO THE DEFENSE :
2,wsj_0049.mrg,N,72,"A former member of the prosecution team in the Iran\/Contra affair joined the Chicago firm of Mayer , Brown & Platt ."
2,wsj_0049.mrg,N,73,"Michael R. Bromwich , a member since January 1987 of the three-lawyer trial team in the prosecution of Oliver North , became a partner in the Washington , D.C. , office of the 520-lawyer firm ."
2,wsj_0049.mrg,N,74,He will specialize in white-collar criminal defense work .
2,wsj_0013.mrg,N,4,"PS of New Hampshire , Manchester , N.H. , values its internal reorganization plan at about $ 2.2 billion *U* ."
2,wsj_0013.mrg,N,10,`` That attracts attention ...
2,wsj_0013.mrg,N,17,"PS of New Hampshire shares closed yesterday at $ 3.75 *U* , off 25 cents , in New York Stock Exchange composite trading ."
2,wsj_0137.mrg,N,0,Tokyo stocks edged up Wednesday in relatively active but unfocused trading .
2,wsj_0137.mrg,N,1,London shares finished moderately higher .
2,wsj_0137.mrg,N,3,"In early trading in Tokyo Thursday , the Nikkei index fell 63.79 points to 35500.64 ."
2,wsj_0137.mrg,N,4,"Wednesday 's volume on the First Section was estimated *-1 at 900 million shares , in line with Tuesday 's 909 million ."
2,wsj_0137.mrg,N,10,Institutions mostly remained on the sidelines because of uncertainty regarding interest rates and the dollar .
2,wsj_0137.mrg,N,13,"Volume in the second section was estimated *-1 at 18 million shares , up from 14 million Tuesday ."
2,wsj_0137.mrg,N,17,"It ended the day up 80 yen -LRB- 56 cents -RRB- to 1,880 yen -LRB- $ 13.15 *U* -RRB- ."
2,wsj_0137.mrg,N,23,Marubeni advanced 11 to 890 .
2,wsj_0137.mrg,N,25,The Financial Times-Stock Exchange 100-share index closed 17.5 points higher at 2160.1 .
2,wsj_0137.mrg,N,29,"Also , several key blue chips were pushed higher in thin volume because of a technical squeeze among market makers ."
2,wsj_0137.mrg,N,31,There were concerns *ICH*-1 early in the day that Wall Street 's sharp gains on Tuesday were overdone and due for a reversal .
2,wsj_0137.mrg,N,32,The FT 30-share index settled 16.7 points higher at 1738.1 .
2,wsj_0137.mrg,N,35,They cited Wall Street 's recent volatility and the lack of a clear indication over the market 's short-term direction as factors in the institutional caution .
2,wsj_0137.mrg,N,42,"Like Jaguar , B.A.T also eased off its highs in afternoon dealings ."
2,wsj_0137.mrg,N,47,Drug companies in the key index also notched gains as market-makers searched for stock in anticipation of demand due to the sector 's defensive qualities .
2,wsj_0137.mrg,N,56,"* To make them directly comparable , each index is based *-1 on the close of 1969 equaling 100 ."
2,wsj_0176.mrg,N,3,"By comparison , for the first nine months , Xerox earned $ 492 million *U* , or $ 4.55 *U* a share , on revenue of $ 12.97 billion *U* ."
2,wsj_0176.mrg,N,5,"Property\/casualty insurance has been a tough business in recent quarters , as pricing has been cutthroat and natural disasters such as Hurricane Hugo and the California earthquake have resulted in huge payments ."
2,wsj_0008.mrg,N,2,The government 's borrowing authority dropped at midnight Tuesday to $ 2.80 trillion *U* from $ 2.87 trillion *U* .
2,wsj_0046.mrg,N,3,The purchase price includes two ancillary companies .
2,wsj_0010.mrg,N,2,The National Association of Manufacturers settled on the Hoosier capital of Indianapolis for its fall board meeting .
2,wsj_0010.mrg,N,5,"On the receiving end of the message were *T*-1 officials from giants like Du Pont and Maytag , along with lesser knowns like Trojan Steel and the Valley Queen Cheese Factory ."
2,wsj_0010.mrg,N,6,"For starters , the executives joined Mayor William H. Hudnut III for an evening of the Indianapolis Symphony Orchestra and a guest pianist-comedian Victor Borge ."
2,wsj_0010.mrg,N,7,Champagne and dessert followed .
2,wsj_0010.mrg,N,8,"The next morning , with a police escort , busloads of executives and their wives raced to the Indianapolis Motor Speedway , *-1 unimpeded by traffic or red lights ."
2,wsj_0010.mrg,N,11,"Then , in the guests ' honor , the speedway hauled out four drivers , crews and even the official Indianapolis 500 announcer for a 10-lap exhibition race ."
2,wsj_0010.mrg,N,12,"After the race , Fortune 500 executives drooled like schoolboys over the cars and drivers ."
2,wsj_0010.mrg,N,19,"But for now , they 're looking forward to their winter meeting -- Boca in February ."
2,wsj_0177.mrg,N,2,Sales rose 11 % to 292.32 billion yen from 263.07 billion yen .
2,wsj_0177.mrg,N,3,Net income surged 31 % to 7.63 billion yen from 5.82 billion yen .
2,wsj_0177.mrg,N,4,Per-share net rose to 7.84 yen from 6.53 yen .
2,wsj_0177.mrg,N,6,"Domestic sales of construction machinery , such as power shovels and bulldozers rose to 142.84 billion yen from 126.15 billion yen ."
2,wsj_0152.mrg,N,3,Telerate 's two independent directors have rejected the offer as inadequate .
2,wsj_0152.mrg,N,4,"In composite trading on the New York Stock Exchange , Telerate shares closed at $ 19.50 *U* , up 12.5 cents ."
2,wsj_0152.mrg,N,5,Telerate provides an electronic financial information network .
2,wsj_0175.mrg,N,6,Both sides are in talks 0 * to settle the dispute *T*-1 .
2,wsj_0117.mrg,N,0,The United Kingdom High Court declared illegal a variety of interest-rate swap transactions and options deals between a London borough council and commercial banks .
2,wsj_0117.mrg,N,3,An appeal is expected *-68 .
2,wsj_0117.mrg,N,13,The council backed the audit commission 's stand that the swap transactions are illegal .
2,wsj_0118.mrg,N,4,But the heated fight over program trading is about much more than a volatile stock market .
