Annotator,Document ID,Shared? ,SentNum,Sent
3,wsj_0166.mrg,N,5,"Transamerica Corp. , San Francisco , said 0 third-quarter profit was essentially flat despite a large one-time gain a year earlier ."
3,wsj_0166.mrg,N,7,"The results reflected a 24 % gain in income from its finance businesses , and a 15 % slide in income from insurance operations ."
3,wsj_0129.mrg,N,3,"Under the so-called Team Taurus approach , Mr. Veraldi and other Ford product planners sought the involvement of parts suppliers , assembly-line workers , auto designers and financial staff members from the initial stages of the development cycle ."
3,wsj_0168.mrg,N,1,The sale represents 10.2 % of Meridian 's shares outstanding .
3,wsj_0168.mrg,N,4,The loan may be extended *-1 by the McAlpine group for an additional year with an increase in the conversion price to $ 2.50 *U* a share .
3,wsj_0035.mrg,N,7,The U.S.S.R. belongs to neither organization .
3,wsj_0035.mrg,N,8,Moscow has settled pre-1917 debts with other countries in recent years at less than face value .
3,wsj_0024.mrg,N,1,"Esso Australia Ltd. , a unit of New York-based Exxon Corp. , and Broken Hill Pty. operate the fields in a joint venture ."
3,wsj_0024.mrg,N,4,The field has reserves of 21 million barrels .
3,wsj_0024.mrg,N,5,Reserves for the five new fields total 50 million barrels .
3,wsj_0085.mrg,N,0,"For 10 years , Genie Driskill went to her neighborhood bank because it was convenient ."
3,wsj_0085.mrg,N,3,"Among other things , it included checking , safe deposit box and credit card -- all for free -- plus a good deal on installment loans ."
3,wsj_0085.mrg,N,6,She took her business to First Atlanta .
3,wsj_0085.mrg,N,9,The competitive rates were generally offset *-1 by hefty fees on various services .
3,wsj_0085.mrg,N,10,But many banks are turning away from strict price competition .
3,wsj_0085.mrg,N,17,"For some time , banks have been aiming packages at the elderly , the demographic segment with the highest savings ."
3,wsj_0085.mrg,N,18,Those efforts are being stepped up *-1 .
3,wsj_0085.mrg,N,23,Banks have tried packaging before .
3,wsj_0085.mrg,N,36,The competition has cultivated a much savvier consumer .
3,wsj_0085.mrg,N,43,Packaging has some drawbacks .
3,wsj_0085.mrg,N,49,"Some banks are already moving in that direction , according to Alvin T. Sale , marketing director at First Union Corp. in Charlotte ."
3,wsj_0085.mrg,N,51,"Soon , it will split those into 30 ."
3,wsj_0096.mrg,N,0,"The National Association of Securities Dealers , the self-regulatory organization for the over-the-counter securities markets , disciplined a number of firms and individuals for alleged violations of industry rules ."
3,wsj_0096.mrg,N,3,"Also , Mr. Vargas was barred *-152 from association with any NASD member ."
3,wsj_0096.mrg,N,4,"Neither First Securities , of Beverly Hills , nor Mr. Vargas could be reached *-153 for comment ."
3,wsj_0096.mrg,N,5,A telephone-information operator had no listing for either party .
3,wsj_0096.mrg,N,7,"Also , Mr. Otero was barred *-154 from association with any NASD member ."
3,wsj_0096.mrg,N,15,Officials of Triton could n't be reached *-157 for comment .
3,wsj_0096.mrg,N,16,Mr. Chase did n't return a telephone call to his office .
3,wsj_0096.mrg,N,17,"Crane & Co. Securities Inc. , of Mount Clemens , Mich. , and its president , Glenn R. Crane , of Sterling Heights , Mich. , consented to a joint fine of $ 10,000 *U* ."
3,wsj_0096.mrg,N,20,"First Commonwealth Securities Corp. , of New Orleans , and its president , Kenneth J. Canepa , also of New Orleans , consented to a $ 10,000 *U* fine ."
3,wsj_0096.mrg,N,21,"Also , Mr. Canepa received a two-week suspension `` in a principal capacity . ''"
3,wsj_0096.mrg,N,24,"Weatherly Securities Corp. , New York , and three of its principals -- Dell Eugene Keehn and William Northy Prater Jr. , both of Mercer Island , Wash. , and Thomas Albert McFall , of Red Bank , N.J . -- consented to a fine of $ 20,000 *U* ."
3,wsj_0096.mrg,N,29,"The firm and Mr. Whelen allegedly sold securities to the public at unfair prices , among other alleged violations ."
3,wsj_0096.mrg,N,32,"Shearson Lehman Hutton Inc. , New York , which *T*-251 is 62%-owned *-1 by American Express Co. , consented to a $ 10,000 *U* fine ."
3,wsj_0096.mrg,N,34,A Shearson spokesman had no comment .
3,wsj_0096.mrg,N,41,"Victor Stanley Fishman , Longwood , Fla. , fined *-1 $ 25,000 *U* ; William Harold Floyd , Houston , $ 100,000 *U* ; Michael Anthony Houston , Bronx , N.Y. , $ 15,000 *U* ; Amin Jalaalwalikraam , Glenham , N.Y. , $ 60,000 *U* ; Richard F. Knapp , London , $ 10,000 *U* and 30-day suspension ; Deborah Renee Martin , St. Louis , $ 15,000 *U* ; Joseph Francis Muscolina Jr. , Palisades Park , N.J. , $ 15,000 *U* ; Robert C. Najarian , Brooklyn Park , Minn. , $ 15,000 *U* ; Edward Robert Norwick , Nesconset , N.Y. , $ 30,000 *U* ."
3,wsj_0096.mrg,N,48,`` I never had any clients at all .
3,wsj_0124.mrg,N,0,"William C. Walbrecher Jr. , an executive at San Francisco-based 1st Nationwide Bank , was named *-1 president *RNR*-2 and chief executive officer *ICH*-2 of Citadel Holding Corp. and its principal operating unit , Fidelity Federal Bank ."
3,wsj_0124.mrg,N,1,The appointment takes effect Nov. 13 .
3,wsj_0124.mrg,N,3,Edward L. Kane succeeded Mr. Taylor as chairman .
3,wsj_0124.mrg,N,4,"Separately , Citadel posted a third-quarter net loss of $ 2.3 million *U* , or 68 cents a share , versus net income of $ 5.3 million *U* , or $ 1.61 *U* a share , a year earlier ."
3,wsj_0124.mrg,N,7,"In addition , operating results were hit *-1 by an increase in loan and real estate loss reserves ."
3,wsj_0124.mrg,N,8,"In American Stock Exchange composite trading , Citadel shares closed yesterday at $ 45.75 *U* , down 25 cents ."
3,wsj_0132.mrg,N,2,"The 32 % state-owned DSM had eight million guilders of extraordinary charges in the latest quarter , mainly * to reflect one-time losses in connection with the disposal of some operations ."
3,wsj_0132.mrg,N,3,The charges were offset *-1 in part by a gain from the sale of the company 's construction division .
3,wsj_0132.mrg,N,4,"Last year , DSM had 71 million guilders of extraordinary charges for the restructuring program and other transactions ."
3,wsj_0132.mrg,N,7,"Sales , however , were little changed *-1 at 2.46 billion guilders , compared with 2.42 billion guilders ."
3,wsj_0185.mrg,N,2,He increases the board to seven .
3,wsj_0133.mrg,N,2,Cataracts refer to a clouding of the eye 's natural lens .
3,wsj_0048.mrg,N,1,The Nasdaq composite index added 1.01 to 456.64 on paltry volume of 118.6 million shares .
3,wsj_0048.mrg,N,4,"In October , the busiest month of the year so far , daily volume averaged roughly 145 million shares ."
3,wsj_0048.mrg,N,5,The Nasdaq 100 index of the biggest nonfinancial stocks gained 1.39 to 446.62 .
3,wsj_0048.mrg,N,9,The two banks merged in 1985 .
3,wsj_0048.mrg,N,10,Bank of New England 's shares are traded *-1 on the New York Stock Exchange .
3,wsj_0048.mrg,N,14,"The biggest beneficiary was Northeast Bancorp , which *T*-118 surged 7 3\/4 to 69 ."
3,wsj_0048.mrg,N,18,"Another OTC bank stock involved * in a buy-out deal , First Constitution Financial , was higher ."
3,wsj_0048.mrg,N,19,It rose 7\/8 to 18 1\/4 .
3,wsj_0048.mrg,N,23,"Among other banking issues , Pennview Savings Association leapt more than 44 % with a gain of 6 5\/8 to 21 5\/8 ."
3,wsj_0048.mrg,N,31,"Also on the takeover front , Jaguar 's ADRs rose 1\/4 to 13 7\/8 on turnover of 4.4 million ."
3,wsj_0048.mrg,N,35,Rally 's lost 1 3\/4 to 21 3\/4 .
3,wsj_0048.mrg,N,39,"SCI Systems slipped 7\/8 to 10 on volume of 858,000 shares ."
3,wsj_0048.mrg,N,41,"In the year-earlier period , SCI had net income of $ 4.8 million *U* , or 23 cents a share , on revenue of $ 225.6 million *U* ."
3,wsj_0081.mrg,N,4,"In New Brunswick , N.J. , a Johnson & Johnson spokesman declined comment ."
3,wsj_0053.mrg,N,1,Sales in stores open more than one year rose 3 % to $ 29.3 million *U* from $ 28.4 million *U* .
3,wsj_0054.mrg,N,2,"Last October , the company also bought a wheel-loader manufacturing plant in Heidelberg , West Germany , from Dresser ."
3,wsj_0119.mrg,N,12,"Currently , the government charges nothing for such filings ."
3,wsj_0038.mrg,N,2,"The warrants expire Nov. 30 , 1990 ."
3,wsj_0086.mrg,N,2,"Currently , ShareData has about 4.1 million common shares outstanding ."
3,wsj_0172.mrg,N,0,First of America Bank Corp. said 0 it completed its acquisition of Midwest Financial Group Inc. for about $ 250 million *U* .
3,wsj_0172.mrg,N,6,"But it said that severance payments to those executives not staying with the company will reduce First of America 's operating results for 1989 by $ 3 million *U* to $ 4 million *U* , or 15 cents to 20 cents a share ."
3,wsj_0170.mrg,N,3,Carnival said 0 it will be an 11 % shareholder in the new company .
3,wsj_0002.mrg,N,0,"Rudolph Agnew , 55 years old and former chairman of Consolidated Gold Fields PLC , was named *-1 a nonexecutive director of this British industrial conglomerate ."
3,wsj_0022.mrg,N,2,"That year the Apple II , Commodore Pet and Tandy TRS-80 came to market ."
3,wsj_0022.mrg,N,5,"But Apple II was a major advance from Apple I , which *T*-1 was built *-33 in a garage by Stephen Wozniak and Steven Jobs for hobbyists such as the Homebrew Computer Club ."
3,wsj_0022.mrg,N,7,"*-1 Crude as they were *?* , these early PCs triggered explosive product development in desktop models for the home and office ."
3,wsj_0022.mrg,N,10,Current PCs are more than 50 times faster and have memory capacity 500 times greater than their 1977 counterparts .
3,wsj_0022.mrg,N,16,"Today , PC shipments annually total some $ 38.3 billion *U* world-wide ."
3,wsj_0061.mrg,N,0,The Life Insurance Co. of Georgia has officially opened an office in Taipei .
3,wsj_0061.mrg,N,2,"Life of Georgia is part of the Nationale Nederlanden Group , based * in the Netherlands ."
3,wsj_0149.mrg,N,2,Such an application for federal antitrust clearance is necessary for any investor that *T*-1 might seek control .
3,wsj_0149.mrg,N,11,But the exact amount of Reliance 's current holding has n't been formally disclosed *-1 .
3,wsj_0149.mrg,N,15,"In composite New York Stock Exchange trading , the shares closed at $ 177 *U* , up $ 1.50 *U* ."
3,wsj_0149.mrg,N,19,Mr. Steinberg is thought *-1 to be on friendly terms with UAL 's Mr. Wolf .
3,wsj_0120.mrg,N,0,FALL BALLOT ISSUES set a record for off-year elections .
3,wsj_0120.mrg,N,1,Odd-year elections attract relatively few ballot issues .
3,wsj_0120.mrg,N,8,"Hot ballot topics are expected *-1 to be abortion , the environment and insurance reform ."
3,wsj_0120.mrg,N,12,"At Christie 's , a folio of 21 prints from Alfred Stieglitz 's `` Equivalents '' series sold for $ 396,000 *U* , a single-lot record ."
3,wsj_0120.mrg,N,13,Other works also have been exceeding price estimates .
3,wsj_0120.mrg,N,16,"`` There is finally some sort of sense in the market , '' she says *T*-1 ."
3,wsj_0120.mrg,N,24,"But more serious applications are in the wings , and that is where the future growth is expected *-1 *T*-2 ."
3,wsj_0120.mrg,N,30,"FAMILY PETS are improving recovery rates of patients at Columbia Hospital , Milwaukee ."
3,wsj_0120.mrg,N,32,TIRED OF * TRIMMING ?
3,wsj_0120.mrg,N,39,"Tiny Tots Inc. , Campbell , Calif. , says 0 business is up 35 % in the past year ."
3,wsj_0120.mrg,N,41,"In Syracuse , N.Y. , DyDee Service 's new marketing push stresses environmental awareness ."
3,wsj_0120.mrg,N,42,Among its new customers : day-care centers that *T*-1 previously spurned the service .
3,wsj_0120.mrg,N,45,"Diaper shortages this summer limited growth at Stork Diaper Services , Springfield , Mass. , where business is up 25 % in *T*-1"
3,wsj_0037.mrg,N,1,"Although *-2 set *-1 in Japan , the novel 's texture is almost entirely Western , especially American ."
3,wsj_0037.mrg,N,11,"A disaffected , hard-drinking , nearly-30 hero sets off for snow country in search of an elusive sheep with a star on its back at the behest of a sinister , erudite mobster with a Stanford degree ."
3,wsj_0037.mrg,N,16,But he is just one of several youthful writers -- Tokyo 's brat pack -- who *T*-57 are dominating the best-seller charts in Japan .
3,wsj_0037.mrg,N,19,"As Mr. Whiting describes it , Nipponese baseball is a `` mirror of Japan 's fabled virtues of hard work and harmony . ''"
3,wsj_0037.mrg,N,20,`` Wa '' is Japanese for `` team spirit '' and Japanese ballplayers have miles and miles of it .
3,wsj_0037.mrg,N,22,"Polls once named Tokyo Giants star Tatsunori Hara , a `` humble , uncomplaining , obedient soul , '' as the male symbol of Japan ."
3,wsj_0037.mrg,N,27,It 's the petulant complaint of an impudent American whom Sony hosted *T*-58 for a year while he was on a Luce Fellowship in Tokyo -- to the regret of both parties .
3,wsj_0037.mrg,N,33,It *EXP*-1 's a shame 0 their meeting never took place .
3,wsj_0037.mrg,N,34,"Mr. Katzenstein certainly would have learned something , and it *EXP*-1 's even possible 0 Mr. Morita would have *?* too ."
3,wsj_0037.mrg,N,35,"Ms. Kirkpatrick , the Journal 's deputy editorial features editor , worked in Tokyo for three years ."
3,wsj_0037.mrg,N,36,More and more corners of the globe are becoming free of tobacco smoke .
3,wsj_0037.mrg,N,39,"Singapore already bans smoking in all theaters , buses , public elevators , hospitals and fast-food restaurants ."
3,wsj_0037.mrg,N,41,South Korea has different concerns .
3,wsj_0037.mrg,N,47,"More than three in five said 0 they are under a great deal of stress most of the time , compared with less than one in two U.S. consumers and one in four in Japan ."
3,wsj_0037.mrg,N,50,A major concern about the current plan is whether the new center can be built *-62 in such a short time .
3,wsj_0037.mrg,N,58,The Polish government increased home electricity charges by 150 % and doubled gas prices .
3,wsj_0004.mrg,N,3,"Average maturity of the funds ' investments lengthened by a day to 41 days , the longest since early August , according to Donoghue 's ."
3,wsj_0004.mrg,N,7,"Nevertheless , said *T*-1 Brenda Malizia Negus , editor of Money Fund Report , yields `` may blip up again before they blip down '' because of recent rises in short-term interest rates ."
3,wsj_0004.mrg,N,10,"Assets of the 400 taxable funds grew by $ 1.5 billion *U* during the latest week , to $ 352.7 billion *U* ."
3,wsj_0004.mrg,N,12,The top money funds are currently yielding well over 9 % .
3,wsj_0004.mrg,N,13,"Dreyfus World-Wide Dollar , the top-yielding fund , had a seven-day compound yield of 9.37 % during the latest week , down from 9.45 % a week earlier ."
3,wsj_0183.mrg,N,2,The law defines unfairly low prices as ones below the cost of production or below prices in an exporter 's home market .
3,wsj_0183.mrg,N,5,"Imports of manmade-fiber sweaters in 1988 totaled about $ 405 million *U* from Taiwan , $ 400 million *U* from South Korea and $ 125 million *U* from Hong Kong , according to the ITC ."
3,wsj_0183.mrg,N,7,These imports totaled about $ 17 million *U* last year .
3,wsj_0063.mrg,N,4,"In August , Temple sweetened the offer to $ 63 *U* a share , or $ 963 million *U* ."
3,wsj_0063.mrg,N,8,We are able *-2 to increase our price above the $ 70 *U* level if necessary .
3,wsj_0063.mrg,N,17,Mr. Sherwood said 0 reaction to Sea Containers ' proposal has been `` very positive . ''
3,wsj_0063.mrg,N,18,"In New York Stock Exchange composite trading yesterday , Sea Containers closed at $ 62.625 *U* , up 62.5 cents ."
3,wsj_0146.mrg,N,4,"As chairman of the House Energy and Commerce Committee , Mr. Dingell has almost single-handed control over clean-air legislation ."
3,wsj_0146.mrg,N,13,"It *EXP*-1 is n't clear , however , whether support for the proposal will be broad enough * to pose a serious challenge to the White House 's acid-rain plan ."
3,wsj_0156.mrg,N,3,Younkers rang up sales *ICH*-1 in 1988 of $ 313 million *U* .
3,wsj_0156.mrg,N,4,It operates stores mostly in Iowa and Nebraska .
3,wsj_0088.mrg,N,5,"With the limit in effect , members would be able *-1 to execute trades at the limit price or at higher prices , but not below it ."
3,wsj_0088.mrg,N,14,A final modification *ICH*-1 was made *-130 to the five-point opening limit for the contract .
3,wsj_0044.mrg,N,0,Cathryn Rice could hardly believe her eyes .
3,wsj_0044.mrg,N,2,"She had seen cheating before , but these notes were uncanny ."
3,wsj_0044.mrg,N,4,"At the end of World War II , Germany surrendered before Japan ... ."
3,wsj_0044.mrg,N,7,"In fact , the student had the answers to almost all of the 40 questions in that section ."
3,wsj_0044.mrg,N,8,"The student surrendered the notes , but not without a protest ."
3,wsj_0044.mrg,N,10,The teacher in question was Nancy Yeargin -- considered by many students and parents * to be one of the best at the school .
3,wsj_0044.mrg,N,24,`` So efforts * to beat the tests are also on the rise . ''
3,wsj_0044.mrg,N,25,"And *-1 most disturbing , it is educators , not students , who *T*-84 are blamed *-2 for much of the wrongdoing ."
3,wsj_0044.mrg,N,28,Evidence of widespread cheating has surfaced in several states in the last year or so .
3,wsj_0044.mrg,N,30,"After numerous occurrences of questionable teacher help to students , Texas is revising its security practices ."
3,wsj_0044.mrg,N,31,And sales of test-coaching booklets for classroom instruction are booming .
3,wsj_0044.mrg,N,32,"These materials , including Macmillan\/McGraw-Hill School Publishing Co. 's Scoring High and Learning Materials -- are nothing short of sophisticated crib sheets , according to some recent academic research ."
3,wsj_0044.mrg,N,37,"High test scores , on the other hand , bring recognition and extra money -- a new computer lab for a school , grants for special projects , a bonus for the superintendent ."
3,wsj_0044.mrg,N,41,Friends of Education rates South Carolina one of the worst seven states in its study on academic cheating .
3,wsj_0044.mrg,N,45,South Carolina 's reforms were designed *-1 for schools like Greenville High School .
3,wsj_0044.mrg,N,47,"But by the early 1980s , its glory *PPA*-1 had faded like the yellow bricks of its broad facade ."
3,wsj_0044.mrg,N,51,Her immediate predecessor suffered a nervous breakdown .
3,wsj_0044.mrg,N,58,"I loved the school , its history ."
3,wsj_0044.mrg,N,72,"Some fellow teachers , however , viewed Mrs. Yeargin as cocky and too yielding to students ."
3,wsj_0044.mrg,N,79,"Huge gains by her students in 1987 and 1988 meant a total of $ 5,000 *U* in bonuses over two years -- a meaningful addition to her annual salary of $ 23,000 *U* ."
3,wsj_0044.mrg,N,89,"The rest were history , sociology , finance -- subjects 0 they never had *T*-1 . ''"
3,wsj_0044.mrg,N,95,The last thing 0 they needed *T*-1 was another drag-down blow . ''
3,wsj_0044.mrg,N,103,I believe in the system .
3,wsj_0012.mrg,Y,13,"According to Audit Bureau of Circulations , Time , the largest newsweekly , had average circulation of 4,393,237 , a decrease of 7.3 % ."
3,wsj_0144.mrg,Y,2,But revenue declined to $ 3 billion *U* from $ 3.2 billion *U* .
3,wsj_0144.mrg,Y,6,"In the first nine months , net was $ 306 million *U* , compared with a loss of $ 195 million *U* in the 1988 period ."
3,wsj_0003.mrg,Y,4,"A Lorillard spokewoman said , `` This is an old story ."
3,wsj_0003.mrg,Y,7,Neither Lorillard nor the researchers who *T*-3 studied the workers were aware of any research on smokers of the Kent cigarettes .
3,wsj_0003.mrg,Y,9,Dr. Talcott led a team of researchers from the National Cancer Institute and the medical schools of Harvard University and Boston University .
3,wsj_0003.mrg,Y,21,"In July , the Environmental Protection Agency imposed a gradual ban on virtually all uses of asbestos ."
3,wsj_0003.mrg,Y,24,Areas of the factory *ICH*-2 were particularly dusty where the crocidolite was used *-8 *T*-1 .
3,wsj_0003.mrg,Y,29,It has no bearing on our work force today .
3,wsj_0126.mrg,Y,4,A stadium craze is sweeping the country .
3,wsj_0126.mrg,Y,7,Most boosters claim 0 the new sports complexes will be moneymakers for their city .
3,wsj_0126.mrg,Y,8,Pepperdine University economist Dean Baim scoffs at that .
3,wsj_0126.mrg,Y,12,San Francisco voters rejected a new ballpark two years ago .
3,wsj_0126.mrg,Y,13,"Last month , Phoenix voters turned thumbs down on a $ 100 million *U* stadium bond and tax proposition ."
3,wsj_0126.mrg,Y,26,"`` The Superdome is an exercise in optimism , a statement of faith , '' he has said *T*-1 ."
3,wsj_0126.mrg,Y,27,"`` It is the very building of it *ICH*-4 that *T*-2 is important , not how much of it *T*-3 is used *-1 or its economics . ''"
3,wsj_0126.mrg,Y,28,An Egyptian Pharaoh could n't have justified his pyramids any better .
3,wsj_0126.mrg,Y,29,But civilization has moved forward since then .
3,wsj_0029.mrg,Y,3,The rest went to investors from France and Hong Kong .
3,wsj_0029.mrg,Y,4,"Earlier this year , Japanese investors snapped up a similar , $ 570 million *U* mortgage-backed securities mutual fund ."
3,wsj_0029.mrg,Y,5,"That fund was put *-41 together by Blackstone Group , a New York investment bank ."
3,wsj_0029.mrg,Y,6,"The latest two funds were assembled *-42 jointly by Goldman , Sachs & Co. of the U.S. and Japan 's Daiwa Securities Co ."
3,wsj_0001.mrg,Y,0,"Pierre Vinken , 61 years old , will join the board as a nonexecutive director Nov. 29 ."
3,wsj_0001.mrg,Y,1,"Mr. Vinken is chairman of Elsevier N.V. , the Dutch publishing group ."
3,wsj_0097.mrg,Y,4,U.S. stock-index futures are n't even traded *-1 in Japan now .
3,wsj_0097.mrg,Y,5,"And because of the time difference , the Japanese *RNR*-1 and the U.S. *RNR*-1 markets ' trading hours do n't overlap ."
3,wsj_0097.mrg,Y,7,"About 11.6 % of all program trading by New York Stock Exchange firms in September took place in foreign markets , according to Big Board data ."
3,wsj_0097.mrg,Y,10,Program trading has taken off in Japan since last year 's introduction of home-market stock-index futures trading on the Tokyo and Osaka stock exchanges .
3,wsj_0097.mrg,Y,14,"`` Maybe it was n't enough , '' a Finance Ministry official noted *T*-1 after the Dec. 7 surge ."
3,wsj_0097.mrg,Y,15,Japan 's regulators have since tightened controls on index-related stock purchases .
3,wsj_0097.mrg,Y,17,"Some U.S. firms , notably Salomon Inc. and Morgan Stanley Group Inc. , have reaped a hefty chunk of their Japanese earnings from index arbitrage , both for customers and for their own accounts ."
3,wsj_0097.mrg,Y,21,"`` It has not been disruptive in the markets here , '' Mr. Maughan said *T*-1 ."
3,wsj_0097.mrg,Y,23,The British also are scrutinizing program trades .
3,wsj_0097.mrg,Y,25,`` We do n't think 0 there is cause for concern at the moment . ''
3,wsj_0097.mrg,Y,26,London serves increasingly as a conduit for program trading of U.S. stocks .
3,wsj_0097.mrg,Y,32,Britain has two main index-arbitrage instruments .
3,wsj_0097.mrg,Y,33,A Financial Times-Stock Exchange 100-share index option contract is traded *-162 on the London Stock Exchange 's Traded Options Market .
3,wsj_0097.mrg,Y,34,And an FT-SE futures contract is traded *-1 on the London International Financial Futures Exchange .
3,wsj_0097.mrg,Y,35,Both contracts have gained a following since the 1987 global market crash .
3,wsj_0104.mrg,Y,0,"Due to an editing error , a letter to the editor in yesterday 's edition from Frederick H. Hallett mistakenly identified the NRDC ."
3,wsj_0087.mrg,Y,0,"Five things 0 you can do *T*-1 for $ 15,000 *U* or less :"
3,wsj_0087.mrg,Y,1,1 . * Buy a new Chevrolet .
3,wsj_0087.mrg,Y,2,2 . * Take a Hawaiian vacation .
3,wsj_0087.mrg,Y,3,3 . * Send your child to a university .
3,wsj_0087.mrg,Y,4,4 . * Buy a diamond necklace .
3,wsj_0087.mrg,Y,5,5 . * Make a lasting difference in the regulatory life of an American savings-and-loan association through the Foster Corporate Parents Plan .
3,wsj_0087.mrg,Y,9,"As a Foster Corporate Parent , you 'll be helping a neighborhood S&L in areas crucial to its survival ."
3,wsj_0087.mrg,Y,12,Performing loans .
3,wsj_0139.mrg,Y,1,"With lipsticks , liners , lotions and creams , There are still beauty plans left 0 * to tackle *T*-1 : But as the years go by , it seems That before I paint , I should spackle ."
3,wsj_0141.mrg,Y,0,"Consumer confidence stayed strong in October , despite the unsettling gyrations of the stock market ."
3,wsj_0141.mrg,Y,4,The index was 116.9 in October 1988 and in the past year has ranged from a low of 112.9 to a high of 120.7 .
3,wsj_0141.mrg,Y,5,It uses a base of 100 in 1985 .
3,wsj_0141.mrg,Y,6,"In October , more people *ICH*-1 said that present business conditions were `` good '' than in September ."
3,wsj_0141.mrg,Y,7,An equal number in each month said that employment conditions were good .
3,wsj_0141.mrg,Y,20,Home purchase plans increased to 3.3 % from 3.1 % in the two recent months .
3,wsj_0141.mrg,Y,22,"In 1989 , home purchase plans have ranged monthly from 2.9 % *RNR*-1 to 3.7 % *RNR*-1 of respondents ."
3,wsj_0090.mrg,Y,1,That has been particularly true this year with many companies raising their payouts more than 10 % .
3,wsj_0090.mrg,Y,4,"That can be a trap for unwary investors , says 0 *T*-1 Richard Bernstein , senior quantitative analyst at Merrill Lynch & Co ."
3,wsj_0090.mrg,Y,13,"Payouts on the S&P 500 stocks rose 10 % in 1988 , according to Standard & Poor 's Corp. , and Wall Street estimates for 1989 growth are generally between 9 % and 14 % *U* ."
3,wsj_0090.mrg,Y,16,"As a result , the market 's dividend yield -- dividends as a percentage of price -- has slid to a level that *T*-232 is fairly low and unenticing by historical standards ."
3,wsj_0090.mrg,Y,18,They are keeping a close watch on the yield on the S&P 500 .
3,wsj_0090.mrg,Y,22,"In fact , `` the market has always tanked ."
