Annotator,Document ID,Shared? ,SentNum,Sent
2,wsj_0118.mrg,N,15,"The Old Guard 's assault on program trading and its practitioners has been fierce and broad-based , in part because some Old Guard members feel 0 their very livelihood is at stake ."
2,wsj_0118.mrg,N,31,"At Kidder , a unit of General Electric Co. , and other big brokerage firms , stockbrokers battle their own firm 's program traders a few floors away ."
2,wsj_0118.mrg,N,33,The Big Board -- the nation 's premier stock exchange -- is sharply divided between its floor traders and its top executives .
2,wsj_0118.mrg,N,38,But we are not going back to 1970 . ''
2,wsj_0118.mrg,N,39,"Again and again , program-trading 's critics raise the `` casino '' theme ."
2,wsj_0118.mrg,N,42,"The program traders , on the other hand , portray old-fashioned stock pickers as the Neanderthals of the industry ."
2,wsj_0118.mrg,N,47,That divergence is what stock index traders seek *T*-69 .
2,wsj_0118.mrg,N,50,"A program trade of $ 5 million *U* of stock typically earns a razor-thin profit of $ 25,000 *U* ."
2,wsj_0118.mrg,N,54,But many experts and traders say that program trading is n't the main reason for stock-market gyrations .
2,wsj_0118.mrg,N,56,"Says *ICH*-1 the Big Board 's Mr. Phelan , `` Volatility is greater than program trading . ''"
2,wsj_0118.mrg,N,62,"Like virtually everything on Wall Street , the program-trading battle is over money , and the traditionalists have been losing out on bundles of it to the New Guard in recent years ."
2,wsj_0118.mrg,N,68,"Today , about $ 200 billion *U* , or 20 % of all pension-fund stock investments , is held *-73 by index funds ."
2,wsj_0118.mrg,N,71,The specialists see any step to electronic trading as a death knell .
2,wsj_0118.mrg,N,74,"Meanwhile , specialists ' trading risks have skyrocketed as a result of stock-market volatility ."
2,wsj_0118.mrg,N,80,Stockbrokers ' business and pay has been falling .
2,wsj_0118.mrg,N,81,"Last year , the average broker earned $ 71,309 *U* , 24 % lower than in 1987 ."
2,wsj_0118.mrg,N,84,`` Do you make sweatshirts or sparkplugs ?
2,wsj_0118.mrg,N,86,"By this September , program traders were doing a record 13.8 % of the Big Board 's average daily trading volume ."
2,wsj_0118.mrg,N,90,"`` There 's a lynch-mob psychology right now , '' says *T*-1 the top program-trading official at a Wall Street firm ."
2,wsj_0118.mrg,N,92,Too much money *ICH*-1 is at stake for program traders to give up .
2,wsj_0118.mrg,N,94,Stock futures trading has minted dozens of millionaires in their 20s and 30s .
2,wsj_0118.mrg,N,97,The anti-programmers are getting some helpful thunder from Congress .
2,wsj_0118.mrg,N,100,` * Sit down !
2,wsj_0118.mrg,N,101,"You will not panic ,"
2,wsj_0118.mrg,N,102,you will not put the financial system in jeopardy . ' ''
2,wsj_0118.mrg,N,103,But the prospects for legislation that *T*-1 targets program trading is unlikely anytime soon .
2,wsj_0118.mrg,N,110,"Currently , margins on stock futures purchases are much lower -- roughly 7 % compared with 50 % for stocks -- * making the futures market much faster and potentially more speculative ."
2,wsj_0118.mrg,N,117,A reinstatement of the uptick rule for program traders would slow their activity considerably .
2,wsj_0118.mrg,N,119,James A. White contributed to this article .
2,wsj_0118.mrg,N,122,Thus the band-wagon psychology of recent days picks up new impetus .
2,wsj_0118.mrg,N,125,"In index arbitrage , the widget is the S&P 500 , and its price is constantly compared between the futures market in Chicago and the stock markets largely in New York ."
2,wsj_0118.mrg,N,138,* Reducing volatility .
2,wsj_0118.mrg,N,145,Why does this large hypothetical seller trade in Chicago instead of New York *T*-1 ?
2,wsj_0118.mrg,N,151,"The speed of his transaction is n't *-1 to be feared *-79 either , because faster and cleaner execution is desirable , not loathsome ."
2,wsj_0118.mrg,N,153,* Encouraging long-term investing .
2,wsj_0118.mrg,N,154,We must be very cautious about * labeling investors as `` long-term '' or `` short-term . ''
2,wsj_0118.mrg,N,158,"In point of fact , volatility as * measured *-2 by the annualized standard deviation of daily stock price movements has frequently been much higher than it is *?* today ."
2,wsj_0118.mrg,N,159,"Periods before the advent of futures or program trading were often more volatile , usually when fundamental market conditions were undergoing change *T*-1 -LRB- 1973-75 , 1937-40 , and 1928-33 for example -RRB- ."
2,wsj_0118.mrg,N,167,* Getting a level playing field .
2,wsj_0118.mrg,N,169,The loudest of these reformers are money managers who *T*-77 cater to smaller investors .
2,wsj_0118.mrg,N,184,"Mr. Allen 's Pittsburgh firm , Advanced Investment Management Inc. , executes program trades for institutions ."
2,wsj_0027.mrg,N,2,"Stephen Akerfeldt , currently vice president finance , will succeed Mr. McAlpine ."
2,wsj_0027.mrg,N,4,"The company has reported declines in operating profit in each of the past three years , despite steady sales growth ."
2,wsj_0027.mrg,N,6,"On the Toronto Stock Exchange yesterday , Magna shares closed up 37.5 Canadian cents to C$ 9.625 *U* ."
2,wsj_0027.mrg,N,11,Neither they nor Mr. McAlpine could be reached *-38 for comment .
2,wsj_0107.mrg,N,3,The broader question is where the Senate stands *T*-1 on the issue .
2,wsj_0066.mrg,N,0,"Sir Peter Walters , 58-year-old chairman of British Petroleum Co. until next March , joins the board of this cement products company on Dec. 1 ."
2,wsj_0091.mrg,N,3,This is where Bell 's patents went *T*-1 .
2,wsj_0143.mrg,N,0,Standard & Poor 's Corp. lowered to double-C from triple-C the rating on about $ 130 million *U* of debt .
2,wsj_0028.mrg,N,0,"Lord Chilver , 63-year-old chairman of English China Clays PLC , was named *-39 a nonexecutive director of this British chemical company ."
2,wsj_0150.mrg,N,2,The financial-services company will pay 0.82 share for each Williams share .
2,wsj_0150.mrg,N,3,"Williams shares , which *T*-2 were *-2 to be delisted *-1 from the New York Stock Exchange after the close of composite trading yesterday , closed at $ 23.25 *U* , off 12.5 cents ."
2,wsj_0150.mrg,N,4,"Primerica closed at $ 28.25 *U* , down 50 cents ."
2,wsj_0150.mrg,N,5,"Williams , Duluth , Ga. , is an insurance and financial-services holding company ."
2,wsj_0150.mrg,N,8,Terms were n't disclosed *-1 .
2,wsj_0163.mrg,N,6,"Freeport-McMoRan , the parent company , holds roughly 80 % of the units outstanding ."
2,wsj_0082.mrg,N,0,Criticism in the U.S. over recent Japanese acquisitions is looming ever larger in the two countries ' relations .
2,wsj_0082.mrg,N,3,Where they disagree *T*-1 is on the subject of U.S. direct investment in Japan .
2,wsj_0082.mrg,N,8,`` U.S. investors should have a greater opportunity at direct investment '' in Japan .
2,wsj_0082.mrg,N,18,Mr. Pickens made considerable political hay with his troubles in Japan .
2,wsj_0082.mrg,N,22,Each side has a litany of recommendations for the other .
2,wsj_0082.mrg,N,23,The U.S. says 0 it is anxious for results .
2,wsj_0082.mrg,N,26,But they have n't clarified what those might be *T*-187 .
2,wsj_0082.mrg,N,28,The Japanese retort that the first round was too early * to make concessions .
2,wsj_0082.mrg,N,35,"`` Little by little , there is progress , '' says *T*-1 the MITI official ."
2,wsj_0082.mrg,N,36,`` Both sides are taking action . ''
2,wsj_0082.mrg,N,37,Elisabeth Rubinfien contributed to this article .
2,wsj_0012.mrg,N,1,"The new ad plan from Newsweek , a unit of the Washington Post Co. , is the second incentive plan 0 the magazine has offered advertisers *T*-1 in three years ."
2,wsj_0012.mrg,N,4,"A full , four-color page in Newsweek will cost $ 100,980 *U* ."
2,wsj_0012.mrg,N,6,U.S. News has yet *-1 to announce its 1990 ad rates .
2,wsj_0012.mrg,N,11,"Both Newsweek and U.S. News have been gaining circulation in recent years without heavy use of electronic giveaways to subscribers , such as telephones or watches ."
2,wsj_0012.mrg,N,12,"However , none of the big three weeklies recorded circulation gains recently ."
2,wsj_0012.mrg,Y,13,"According to Audit Bureau of Circulations , Time , the largest newsweekly , had average circulation of 4,393,237 , a decrease of 7.3 % ."
2,wsj_0144.mrg,Y,2,But revenue declined to $ 3 billion *U* from $ 3.2 billion *U* .
2,wsj_0144.mrg,Y,6,"In the first nine months , net was $ 306 million *U* , compared with a loss of $ 195 million *U* in the 1988 period ."
2,wsj_0003.mrg,Y,4,"A Lorillard spokewoman said , `` This is an old story ."
2,wsj_0003.mrg,Y,7,Neither Lorillard nor the researchers who *T*-3 studied the workers were aware of any research on smokers of the Kent cigarettes .
2,wsj_0003.mrg,Y,9,Dr. Talcott led a team of researchers from the National Cancer Institute and the medical schools of Harvard University and Boston University .
2,wsj_0003.mrg,Y,21,"In July , the Environmental Protection Agency imposed a gradual ban on virtually all uses of asbestos ."
2,wsj_0003.mrg,Y,24,Areas of the factory *ICH*-2 were particularly dusty where the crocidolite was used *-8 *T*-1 .
2,wsj_0003.mrg,Y,29,It has no bearing on our work force today .
2,wsj_0126.mrg,Y,4,A stadium craze is sweeping the country .
2,wsj_0126.mrg,Y,7,Most boosters claim 0 the new sports complexes will be moneymakers for their city .
2,wsj_0126.mrg,Y,8,Pepperdine University economist Dean Baim scoffs at that .
2,wsj_0126.mrg,Y,12,San Francisco voters rejected a new ballpark two years ago .
2,wsj_0126.mrg,Y,13,"Last month , Phoenix voters turned thumbs down on a $ 100 million *U* stadium bond and tax proposition ."
2,wsj_0126.mrg,Y,26,"`` The Superdome is an exercise in optimism , a statement of faith , '' he has said *T*-1 ."
2,wsj_0126.mrg,Y,27,"`` It is the very building of it *ICH*-4 that *T*-2 is important , not how much of it *T*-3 is used *-1 or its economics . ''"
2,wsj_0126.mrg,Y,28,An Egyptian Pharaoh could n't have justified his pyramids any better .
2,wsj_0126.mrg,Y,29,But civilization has moved forward since then .
2,wsj_0029.mrg,Y,3,The rest went to investors from France and Hong Kong .
2,wsj_0029.mrg,Y,4,"Earlier this year , Japanese investors snapped up a similar , $ 570 million *U* mortgage-backed securities mutual fund ."
2,wsj_0029.mrg,Y,5,"That fund was put *-41 together by Blackstone Group , a New York investment bank ."
2,wsj_0029.mrg,Y,6,"The latest two funds were assembled *-42 jointly by Goldman , Sachs & Co. of the U.S. and Japan 's Daiwa Securities Co ."
2,wsj_0001.mrg,Y,0,"Pierre Vinken , 61 years old , will join the board as a nonexecutive director Nov. 29 ."
2,wsj_0001.mrg,Y,1,"Mr. Vinken is chairman of Elsevier N.V. , the Dutch publishing group ."
2,wsj_0097.mrg,Y,4,U.S. stock-index futures are n't even traded *-1 in Japan now .
2,wsj_0097.mrg,Y,5,"And because of the time difference , the Japanese *RNR*-1 and the U.S. *RNR*-1 markets ' trading hours do n't overlap ."
2,wsj_0097.mrg,Y,7,"About 11.6 % of all program trading by New York Stock Exchange firms in September took place in foreign markets , according to Big Board data ."
2,wsj_0097.mrg,Y,10,Program trading has taken off in Japan since last year 's introduction of home-market stock-index futures trading on the Tokyo and Osaka stock exchanges .
2,wsj_0097.mrg,Y,14,"`` Maybe it was n't enough , '' a Finance Ministry official noted *T*-1 after the Dec. 7 surge ."
2,wsj_0097.mrg,Y,15,Japan 's regulators have since tightened controls on index-related stock purchases .
2,wsj_0097.mrg,Y,17,"Some U.S. firms , notably Salomon Inc. and Morgan Stanley Group Inc. , have reaped a hefty chunk of their Japanese earnings from index arbitrage , both for customers and for their own accounts ."
2,wsj_0097.mrg,Y,21,"`` It has not been disruptive in the markets here , '' Mr. Maughan said *T*-1 ."
2,wsj_0097.mrg,Y,23,The British also are scrutinizing program trades .
2,wsj_0097.mrg,Y,25,`` We do n't think 0 there is cause for concern at the moment . ''
2,wsj_0097.mrg,Y,26,London serves increasingly as a conduit for program trading of U.S. stocks .
2,wsj_0097.mrg,Y,32,Britain has two main index-arbitrage instruments .
2,wsj_0097.mrg,Y,33,A Financial Times-Stock Exchange 100-share index option contract is traded *-162 on the London Stock Exchange 's Traded Options Market .
2,wsj_0097.mrg,Y,34,And an FT-SE futures contract is traded *-1 on the London International Financial Futures Exchange .
2,wsj_0097.mrg,Y,35,Both contracts have gained a following since the 1987 global market crash .
2,wsj_0104.mrg,Y,0,"Due to an editing error , a letter to the editor in yesterday 's edition from Frederick H. Hallett mistakenly identified the NRDC ."
2,wsj_0087.mrg,Y,0,"Five things 0 you can do *T*-1 for $ 15,000 *U* or less :"
2,wsj_0087.mrg,Y,1,1 . * Buy a new Chevrolet .
2,wsj_0087.mrg,Y,2,2 . * Take a Hawaiian vacation .
2,wsj_0087.mrg,Y,3,3 . * Send your child to a university .
2,wsj_0087.mrg,Y,4,4 . * Buy a diamond necklace .
2,wsj_0087.mrg,Y,5,5 . * Make a lasting difference in the regulatory life of an American savings-and-loan association through the Foster Corporate Parents Plan .
2,wsj_0087.mrg,Y,9,"As a Foster Corporate Parent , you 'll be helping a neighborhood S&L in areas crucial to its survival ."
2,wsj_0087.mrg,Y,12,Performing loans .
2,wsj_0139.mrg,Y,1,"With lipsticks , liners , lotions and creams , There are still beauty plans left 0 * to tackle *T*-1 : But as the years go by , it seems That before I paint , I should spackle ."
2,wsj_0141.mrg,Y,0,"Consumer confidence stayed strong in October , despite the unsettling gyrations of the stock market ."
2,wsj_0141.mrg,Y,4,The index was 116.9 in October 1988 and in the past year has ranged from a low of 112.9 to a high of 120.7 .
2,wsj_0141.mrg,Y,5,It uses a base of 100 in 1985 .
2,wsj_0141.mrg,Y,6,"In October , more people *ICH*-1 said that present business conditions were `` good '' than in September ."
2,wsj_0141.mrg,Y,7,An equal number in each month said that employment conditions were good .
2,wsj_0141.mrg,Y,20,Home purchase plans increased to 3.3 % from 3.1 % in the two recent months .
2,wsj_0141.mrg,Y,22,"In 1989 , home purchase plans have ranged monthly from 2.9 % *RNR*-1 to 3.7 % *RNR*-1 of respondents ."
2,wsj_0090.mrg,Y,1,That has been particularly true this year with many companies raising their payouts more than 10 % .
2,wsj_0090.mrg,Y,4,"That can be a trap for unwary investors , says 0 *T*-1 Richard Bernstein , senior quantitative analyst at Merrill Lynch & Co ."
2,wsj_0090.mrg,Y,13,"Payouts on the S&P 500 stocks rose 10 % in 1988 , according to Standard & Poor 's Corp. , and Wall Street estimates for 1989 growth are generally between 9 % and 14 % *U* ."
2,wsj_0090.mrg,Y,16,"As a result , the market 's dividend yield -- dividends as a percentage of price -- has slid to a level that *T*-232 is fairly low and unenticing by historical standards ."
2,wsj_0090.mrg,Y,18,They are keeping a close watch on the yield on the S&P 500 .
2,wsj_0090.mrg,Y,22,"In fact , `` the market has always tanked ."
2,wsj_0090.mrg,Y,25,The last time 0 the S&P 500 yield dropped below 3 % *T*-1 was in the summer of 1987 .
2,wsj_0090.mrg,Y,29,"Still , some market analysts say 0 the current 3.3 % reading is n't as troublesome as it might have been *?* in years past ."
2,wsj_0090.mrg,Y,32,"So , while stock prices may look fairly high relative to dividends , they are not excessive relative to the underlying corporate strength ."
2,wsj_0090.mrg,Y,35,"That is just a tad below the average of the past 40 years or so , he says 0 *T*-1 ."
2,wsj_0090.mrg,Y,36,What *T*-234 will happen to dividend growth next year ?
2,wsj_0090.mrg,Y,41,Dividend growth on the order of 12 % is expected *-142 by both Mr. Coxon of Cigna and Mr. Einhorn of Goldman Sachs .
2,wsj_0090.mrg,Y,46,"While the S&P tally does n't measure the magnitude of dividend changes , a further slippage in the number of dividend increases could be a harbinger of slower dividend growth next year ."
2,wsj_0153.mrg,Y,1,"The aerospace , automotive supply , electronics and printing-press concern also indicated that the first half of fiscal 1990 could be rough ."
2,wsj_0153.mrg,Y,4,"For fiscal 1989 's fourth quarter , Rockwell 's net income totaled $ 126.1 million *U* , or 50 cents a share ."
2,wsj_0153.mrg,Y,5,"That compares with operating earnings of $ 132.9 million *U* , or 49 cents a share , the year earlier ."
2,wsj_0153.mrg,Y,7,Sales rose 4 % to $ 3.28 billion *U* from $ 3.16 billion *U* .
2,wsj_0153.mrg,Y,9,"Overall , pretax electronics earnings soared 12 % to $ 107.9 million *U* from $ 96.4 million *U* ."
2,wsj_0153.mrg,Y,16,"The company also took hits in the fourth quarters of 1989 and 1988 on a fixed-price weapons-modernization development program -- probably the C-130 gunship , according to analysts ."
2,wsj_0153.mrg,Y,17,"For fiscal 1989 , the company posted net of $ 734.9 million *U* , or $ 2.87 *U* a share , down from $ 811.9 million *U* , or $ 3.04 *U* a share , in fiscal 1988 ."
2,wsj_0153.mrg,Y,18,"* Excluding one-time additions to profit in each year , earnings per share were $ 2.47 *U* , up 7.4 % from $ 2.30 *U* in fiscal 1988 ."
2,wsj_0153.mrg,Y,19,Sales for the year rose 5 % to $ 12.52 billion *U* from $ 11.95 billion *U* in fiscal 1988 .
2,wsj_0059.mrg,Y,7,"Sterling was quoted *-1 at $ 1.5755 *U* , down from $ 1.5805 *U* late Tuesday ."
2,wsj_0059.mrg,Y,8,"In Tokyo Thursday , the U.S. currency opened for trading at 143.93 yen , up from Wednesday 's Tokyo close of 143.08 yen ."
2,wsj_0059.mrg,Y,11,"He cites the recent deal between the Mitsubishi Estate Co. and the Rockefeller Group , as well as the possible white knight role of an undisclosed Japanese company in the Georgia-Pacific Corp. takeover bid for Great Northern Nekoosa Corp. as evidence ."
2,wsj_0059.mrg,Y,21,"On the Commodity Exchange in New York , gold for current delivery settled at $ 374.20 *U* an ounce , down 50 cents ."
2,wsj_0059.mrg,Y,22,Estimated volume was a moderate 3.5 million ounces .
2,wsj_0059.mrg,Y,23,"In early trading in Hong Kong Thursday , gold was quoted *-1 at $ 374.19 *U* an ounce ."
2,wsj_0154.mrg,Y,2,"That package now sells for about $ 2,099 *U* ."
2,wsj_0131.mrg,Y,0,"Odyssey Partners Limited Partnership , an investment firm , completed the purchase of May Department Stores Co. 's Caldor discount chain for $ 500 million *U* plus the assumption of $ 52 million *U* in debt ."
2,wsj_0131.mrg,Y,2,"May Stores , St. Louis , runs such well-known department stores as Lord & Taylor ."
2,wsj_0109.mrg,Y,3,Wall Street reacted favorably to Mr. McGovern 's departure and its implications .
2,wsj_0109.mrg,Y,9,"Campbell 's international businesses , particularly in the U.K. and Italy , appear *-1 to be at the heart of its problems ."
2,wsj_0109.mrg,Y,10,Growth has fallen short of targets and operating earnings are far below results in U.S. units .
2,wsj_0109.mrg,Y,12,"Similarly , Campbell 's Italian biscuit operation , D. Lazzaroni & Co. , has been hurt *-40 by overproduction and distribution problems ."
2,wsj_0109.mrg,Y,14,"However , neither Mr. Baum nor Mr. Harper has much international experience ."
2,wsj_0109.mrg,Y,18,"Mr. McGovern , 63 , had been under intense pressure *ICH*-1 from the board * to boost Campbell 's mediocre performance to the level of other food companies ."
2,wsj_0109.mrg,Y,29,"For fiscal 1989 , Mr. McGovern received a salary of $ 877,663 *U* ."
2,wsj_0093.mrg,Y,0,It was Richard Nixon 's first visit to China in 1972 that *T*-238 set in motion the historic rapprochement between Beijing and Washington .
2,wsj_0093.mrg,Y,3,"The Chinese , in turn , took aim at American `` interference '' in China 's domestic affairs ."
2,wsj_0093.mrg,Y,6,"The tension was evident on Wednesday evening during Mr. Nixon 's final banquet toast , normally an opportunity for * reciting platitudes about eternal friendship ."
2,wsj_0093.mrg,Y,10,The Chinese responded in an equally undiplomatic fashion .
2,wsj_0093.mrg,Y,13,China was the real victim and it *EXP*-1 is unjust * to reprove China for it . ''
2,wsj_0093.mrg,Y,16,"Relations between China and the U.S. have been tense since June 7 , when Chinese dissident Fang Lizhi and his wife , Li Shuxian , took refuge in the U.S. Embassy in Beijing *T*-1 ."
2,wsj_0093.mrg,Y,21,Mr. Nixon was *-1 to leave China today .
3,wsj_0093.mrg,N,22,"According to an American member of the Nixon party , the former president raised a number of controversial issues in his 20 hours of talks with top-level Chinese officials ."
3,wsj_0093.mrg,N,23,"These included China 's economic policies , human rights and the question of Mr. Fang ."
3,wsj_0093.mrg,N,25,China pulled out of the program in July .
3,wsj_0093.mrg,N,36,The rifles were n't loaded *-1 .
3,wsj_0067.mrg,N,3,"Currently , both Massachusetts and Connecticut , where most of Bank of New England 's operations are *T*-1 , allow interstate banking only within New England ."
3,wsj_0067.mrg,N,6,"He added , `` There 's nothing very hot . ''"
3,wsj_0067.mrg,N,7,Mr. Driscoll did n't elaborate about who the potential partners were *T*-1 or when the talks were held *-94 *T*-2 .
3,wsj_0078.mrg,N,1,Net income more than tripled to 4.898 billion yen from 1.457 billion yen a year earlier .
3,wsj_0089.mrg,N,8,"Now , only one local ringer *ICH*-1 remains : 64-year-old Derek Hammond ."
3,wsj_0089.mrg,N,9,The others here today live elsewhere .
3,wsj_0089.mrg,N,16,It *EXP*-1 is easy * to see why the ancient art is on the ropes *T*-2 .
3,wsj_0089.mrg,N,23,"A series of 5,000 or so changes is a `` peal '' and takes about three hours ."
3,wsj_0089.mrg,N,33,"It is a passion that *T*-227 usually stays in the tower , however ."
3,wsj_0089.mrg,N,36,This does not sit well with some clerics .
3,wsj_0089.mrg,N,40,"An entirely new band *ICH*-2 rings today at Great Torrington , several of whom *T*-1 are members of the congregation ."
3,wsj_0089.mrg,N,41,But there still are n't enough ringers 0 *T*-1 to ring more than six of the eight bells .
3,wsj_0089.mrg,N,52,Mr. Baldwin is also attacking the greater problem : lack of ringers .
3,wsj_0089.mrg,N,58,"They are n't accepted *-1 everywhere , however ."
3,wsj_0033.mrg,N,1,The total marks the sixth consecutive monthly decline .
3,wsj_0033.mrg,N,3,The announcement follows a sharper $ 2.2 billion *U* decline in the country 's foreign reserves in September to $ 86.12 billion *U* .
3,wsj_0041.mrg,N,0,"This is the year 0 the negative ad , for years a secondary presence in most political campaigns , became the main event *T*-1 ."
3,wsj_0041.mrg,N,7,"In 1989 , as often as not , the principal fights in the major campaigns are prompted *-1 by the ads themselves ."
3,wsj_0041.mrg,N,10,"The screen fills with a small , tight facial shot of David Dinkins , Democratic candidate for mayor of New York City ."
3,wsj_0041.mrg,N,17,"The screen shows two distorted , unrecognizable photos , presumably of two politicians ."
3,wsj_0041.mrg,N,20,The other has opposed a ban on cop-killer bullets .
3,wsj_0041.mrg,N,21,One claims 0 he 's pro-choice .
3,wsj_0041.mrg,N,24,Who 's *T*-1 telling the truth ?
3,wsj_0041.mrg,N,30,The campaign has blamed these reporting problems on computer errors .
3,wsj_0041.mrg,N,33,"Mr. Giuliani 's campaign chairman , Peter Powers , says 0 the Dinkins ad is `` deceptive . ''"
3,wsj_0041.mrg,N,55,`` * Consider Jim Courter . ''
3,wsj_0041.mrg,N,58,And the nose on Mr. Courter 's face grows .
3,wsj_0041.mrg,N,60,"In this one , the screen fills with photographs of both candidates ."
3,wsj_0041.mrg,N,64,Who *T*-1 's telling the truth ?
3,wsj_0041.mrg,N,65,"Stephen Salmore , a political scientist at New Jersey 's Eagleton Institute , says 0 it 's another example of an ad that *T*-1 's true but not fully accurate ."
3,wsj_0041.mrg,N,68,But it 's building on a long tradition .
3,wsj_0136.mrg,N,2,"In fiscal 1988 , the company earned $ 17.3 million *U* , or $ 1.92 *U* a share , on revenue of $ 352.9 million *U* ."
3,wsj_0136.mrg,N,3,"Oshkosh Truck attributed the downturn in its earnings to higher start-up costs of its new chassis division , a softer motor-home market and higher administrative costs of compliance with government contractor regulations ."
3,wsj_0051.mrg,N,7,All the contracts were for computer-system-design contracts and involved no hardware or software .
3,wsj_0051.mrg,N,12,"The bids , he added 0 *T*-1 , were `` contrary to common sense . ''"
3,wsj_0051.mrg,N,16,The fire is also fueled *-1 by growing international interest in Japanese behavior .
3,wsj_0051.mrg,N,18,"But in one of the auctions in question , International Business Machines Corp. made a bid substantially higher than the Fujitsu offer , according to the municipality ."
3,wsj_0051.mrg,N,19,The low-ball bids touch on issues central to the increasingly tense trade debate .
3,wsj_0051.mrg,N,32,"`` One yen is not ethical , '' Michio Sasaki , an official at Keidanren , the Japan Federation of Economic Organizations , said *T*-1 ."
3,wsj_0051.mrg,N,33,"`` Profit may be low , but at least costs should be covered *-1 ."
3,wsj_0084.mrg,N,0,"Hudson General Corp. 's president and chief executive officer , Alan J. Stearn , resigned ."
3,wsj_0084.mrg,N,1,"Mr. Stearn , 46 years old , could n't be reached *-120 for comment ."
3,wsj_0084.mrg,N,4,"Mr. Stearn , who *T*-196 had been with the company more than 20 years and had been president since 1984 , will act as a consultant to Hudson General ."
3,wsj_0084.mrg,N,5,His duties as chief executive will be assumed *-121 by Chairman Jay B. Langner .
3,wsj_0127.mrg,N,5,"Reed is paying an interim dividend of 4.6 pence , up 15 % from 4 pence a year earlier ."
3,wsj_0127.mrg,N,6,Sales fell 20 % to # 722 million *U* .
3,wsj_0166.mrg,N,2,Last year 's figures include a one-time loss of $ 12 million *U* for restructuring and unusual items .
